{"fixture_set_id":"HIT-V040-RUBRIC-BOUNDARIES-001","candidate_version":"0.4.0-candidate","governing_decision":"ADR-0002","source_review":"HIT-ARFR-001","case_count":48,"cases":[{"case_id":"FR-01-A","friction_id":"FR-01","role":"accepted","description":"Explicit process record establishes nonexistence.","facts":{"explicit_nonexistence":true},"expected":{"finding":0}},{"case_id":"FR-01-R","friction_id":"FR-01","role":"rejected","description":"Documentary silence cannot support absence.","facts":{"only_silence":true},"expected":{"finding":"IE"}},{"case_id":"FR-01-B","friction_id":"FR-01","role":"boundary","description":"Incomplete search leaves absence unresolved.","facts":{"complete_record_search_absent":false},"expected":{"finding":"IE"}},{"case_id":"FR-02-A","friction_id":"FR-02","role":"accepted","description":"Process-specific role artifact applies to unit, decision, and period.","facts":{"process_specific_artifact":true,"defined_or_assigned":true,"applies_to_unit":true,"applies_to_decision_type":true,"applies_to_period":true},"expected":{"finding":1}},{"case_id":"FR-02-R","friction_id":"FR-02","role":"rejected","description":"Generic job description lacks process applicability.","facts":{"process_specific_artifact":false,"defined_or_assigned":true,"applies_to_unit":false,"applies_to_decision_type":false,"applies_to_period":false},"expected":{"finding":"IE"}},{"case_id":"FR-02-B","friction_id":"FR-02","role":"boundary","description":"Role applies to unit and decision but period is unresolved.","facts":{"process_specific_artifact":true,"defined_or_assigned":true,"applies_to_unit":true,"applies_to_decision_type":true,"applies_to_period":false},"expected":{"finding":"IE"}},{"case_id":"FR-03-A","friction_id":"FR-03","role":"accepted","description":"Observed exercise affected the decision path.","facts":{"observed_exercise":true},"expected":{"finding":2}},{"case_id":"FR-03-R","friction_id":"FR-03","role":"rejected","description":"Formal presence plus hypothetical capability is not substantive exercise.","facts":{"formal_presence":true,"operational_capability":false},"expected":{"finding":1}},{"case_id":"FR-03-B","friction_id":"FR-03","role":"boundary","description":"Directly tested operational capability supports 2 when the sample cannot contain exercise.","facts":{"operational_capability":true,"named_authority":true,"mechanism_available":true,"consequence_identified":true,"no_material_barrier":true,"sample_does_not_permit_observed_exercise":true},"expected":{"finding":2}},{"case_id":"FR-04-A","friction_id":"FR-04","role":"accepted","description":"Named authority reviewed underlying evidence before decision.","facts":{"actual_predecision_access":true,"relevant_underlying_evidence":true,"timing_known":true},"expected":{"finding":2}},{"case_id":"FR-04-R","friction_id":"FR-04","role":"rejected","description":"General access permission without retrieval is ceremonial.","facts":{"formal_access_route":true},"expected":{"finding":1}},{"case_id":"FR-04-B","friction_id":"FR-04","role":"boundary","description":"Underlying evidence was retrieved but timing is unresolved.","facts":{"actual_predecision_access":true,"relevant_underlying_evidence":true,"timing_known":false},"expected":{"finding":"IE"}},{"case_id":"FR-05-A","friction_id":"FR-05","role":"accepted","description":"Reviewer-authored reasoning establishes independent judgment.","facts":{"direct_independent_reasoning":true},"expected":{"finding":2}},{"case_id":"FR-05-R","friction_id":"FR-05","role":"rejected","description":"One indirect indicator does not establish ceremonial judgment.","facts":{"formal_review":true,"indirect_indicator_count":1,"process_specific":true},"expected":{"finding":"IE"}},{"case_id":"FR-05-B","friction_id":"FR-05","role":"boundary","description":"Two indicators are offset by material contrary evidence.","facts":{"formal_review":true,"indirect_indicator_count":2,"process_specific":true,"material_contrary_evidence":true},"expected":{"finding":"IE"}},{"case_id":"FR-06-A","friction_id":"FR-06","role":"accepted","description":"Named authority passed an operational override test with specified consequence.","facts":{"operational_test":true,"named_authority":true,"institution_controls_mechanism":true,"specified_consequence":true},"expected":{"finding":2}},{"case_id":"FR-06-R","friction_id":"FR-06","role":"rejected","description":"Formal authority is ceremonial when the vendor controls intervention.","facts":{"formal_authority":true,"institution_controls_mechanism":false},"expected":{"finding":1}},{"case_id":"FR-06-B","friction_id":"FR-06","role":"boundary","description":"Authority and mechanism ownership cannot be established.","facts":{},"expected":{"finding":"IE"}},{"case_id":"FR-07-A","friction_id":"FR-07","role":"accepted","description":"Appeal produced substantive reconsideration by an authority able to alter outcome.","facts":{"substantive_reconsideration":true,"practical_authority_to_alter":true},"expected":{"finding":2}},{"case_id":"FR-07-R","friction_id":"FR-07","role":"rejected","description":"Appeal intake without reconsideration is ceremonial.","facts":{"channel_exists":true,"intake_only":true},"expected":{"finding":1}},{"case_id":"FR-07-B","friction_id":"FR-07","role":"boundary","description":"Record does not establish whether a channel existed.","facts":{},"expected":{"finding":"IE"}},{"case_id":"FR-08-A","friction_id":"FR-08","role":"accepted","description":"Corroborated harm triggered repair and a person-level remedy was delivered.","facts":{"specific_contemporaneous_harm_evidence":true,"independent_corroboration":true,"delivered_person_level_remedy":true},"expected":{"trigger":"triggered","finding":2}},{"case_id":"FR-08-R","friction_id":"FR-08","role":"rejected","description":"Alleged harm without substantiation leaves the trigger indeterminate.","facts":{"specific_contemporaneous_harm_evidence":true,"independent_corroboration":false,"formal_repair_owner":true},"expected":{"trigger":"indeterminate","finding":"IE"}},{"case_id":"FR-08-B","friction_id":"FR-08","role":"boundary","description":"No qualifying harm occurred; formal repair ownership alone is not exercised repair.","facts":{"affirmative_no_qualifying_harm":true,"capability_testing_in_boundary":true,"formal_repair_owner":true},"expected":{"trigger":"not_triggered","finding":1}},{"case_id":"FR-09-A","friction_id":"FR-09","role":"accepted","description":"Declared follow-up links an operative architecture change to the assessed failure.","facts":{"followup_period_declared":true,"change_identifiable":true,"change_linked_to_assessed_failure":true,"implementing_actor_identified":true,"operative_change":true},"expected":{"finding":2}},{"case_id":"FR-09-R","friction_id":"FR-09","role":"rejected","description":"Unrelated later change does not establish reform, despite formal authority.","facts":{"formal_reform_authority":true,"followup_period_declared":true,"change_identifiable":true,"change_linked_to_assessed_failure":false,"implementing_actor_identified":true,"operative_change":true},"expected":{"finding":1}},{"case_id":"FR-09-B","friction_id":"FR-09","role":"boundary","description":"Externally compelled change without substantive institutional implementation supports only formal presence.","facts":{"formal_reform_authority":true,"followup_period_declared":true,"change_identifiable":true,"change_linked_to_assessed_failure":true,"implementing_actor_identified":true,"operative_change":true,"externally_compelled":true,"institution_substantively_implemented_or_extended":false},"expected":{"finding":1}},{"case_id":"FR-10-A","friction_id":"FR-10","role":"accepted","description":"Institutional-record and packet integrity are assessed separately.","facts":{"institutional_component_present":true,"packet_component_present":true,"combined_only":false},"expected":{"valid":true}},{"case_id":"FR-10-R","friction_id":"FR-10","role":"rejected","description":"One combined integrity status conceals the assessment object.","facts":{"institutional_component_present":true,"packet_component_present":true,"combined_only":true},"expected":{"valid":false}},{"case_id":"FR-10-B","friction_id":"FR-10","role":"boundary","description":"Packet integrity is omitted.","facts":{"institutional_component_present":true,"packet_component_present":false},"expected":{"valid":false}},{"case_id":"FR-11-A","friction_id":"FR-11","role":"accepted","description":"Two adequate components derive adequate overall integrity.","facts":{"institutional_status":"adequate","packet_status":"adequate"},"expected":{"overall_status":"adequate"}},{"case_id":"FR-11-R","friction_id":"FR-11","role":"rejected","description":"Any unreliable component dominates the overall status.","facts":{"institutional_status":"adequate","packet_status":"unreliable"},"expected":{"overall_status":"unreliable"}},{"case_id":"FR-11-B","friction_id":"FR-11","role":"boundary","description":"IE dominates limited when trustworthiness cannot be determined.","facts":{"institutional_status":"IE","packet_status":"limited"},"expected":{"overall_status":"IE"}},{"case_id":"FR-12-A","friction_id":"FR-12","role":"accepted","description":"Rare exercise does not elevate the dominant period pattern.","facts":{"boundary_type":"period","dominant_pattern_finding":1,"exception_finding":2,"exception_generally_available":false},"expected":{"finding":1,"scope":"dominant_pattern"}},{"case_id":"FR-12-R","friction_id":"FR-12","role":"rejected","description":"A claimed exceptional exercise still resolves to the dominant pattern when not generally available.","facts":{"boundary_type":"period","dominant_pattern_finding":0,"exception_finding":2,"exception_generally_available":false},"expected":{"finding":0,"scope":"dominant_pattern"}},{"case_id":"FR-12-B","friction_id":"FR-12","role":"boundary","description":"An event-specific boundary may report the event finding without institutional generalization.","facts":{"boundary_type":"event","event_finding":2},"expected":{"finding":2,"scope":"event_sp